<?xml version="1.0"?>
<ResultSet xmlns:xsi="http://www.w3.org/2001/XMLSchema-instance" xmlns="urn:yahoo:maps" xsi:schemaLocation="urn:yahoo:maps http://api.local.yahoo.com/MapsService/V1/GeocodeResponse.xsd"><Result precision="zip"><Latitude>43.733514</Latitude><Longitude>-88.568017</Longitude><Address></Address><City>Fond Du Lac</City><State>WI</State><Zip></Zip><Country>US</Country></Result><Result precision="zip"><Latitude>39.708718</Latitude><Longitude>-105.597875</Longitude><Address></Address><City>Idaho Springs</City><State>CO</State><Zip></Zip><Country>US</Country></Result><Result precision="zip"><Latitude>41.223383</Latitude><Longitude>-79.632066</Longitude><Address></Address><City>Salem Twp</City><State>PA</State><Zip></Zip><Country>US</Country></Result><Result precision="zip"><Latitude>33.392225</Latitude><Longitude>-93.288924</Longitude><Address></Address><City>Waldo</City><State>AR</State><Zip></Zip><Country>US</Country></Result></ResultSet>

<!-- ws04.ydn.re2.yahoo.com compressed/chunked Sun Aug  9 13:03:57 PDT 2009 -->
